punkt,text
PRV_89.,"Для обеспечения устойчивости лесов их крепление к зданию (сооружению) должны производиться способами и в местах, указанных в проектной документации или организационно-технологической документации на производство работ. При отсутствии таких указаний крепление лесов должно осуществляться не менее чем через один ярус для крайних стоек, через два пролета для верхнего яруса и одного крепления на каждые 50 м проекции поверхности лесов на фасад здания (сооружения)."
PRV_90.,"Для крепления лесов к внутренней стороне стенки металлических вертикальных цилиндрических резервуаров для хранения нефти и нефтепродуктов на объектах нового строительства, технического перевооружения и реконструкции должны применяться магнитные захваты.
Крепление магнитных захватов к лесам допускается как к вертикальным и горизонтальным элементам лесов.
Крепление магнитных зацепов к лесам выполняется с помощью соединительных элементов (карабинов) или аналогичных соединительных элементов, выдерживающих нагрузку не менее 600 кгс (5,8 кН).
Крепление магнитных захватов выполняется с третьего яруса резервуара, через два пролета для верхнего яруса и одного крепления на каждые 50 м2 проекции поверхности лесов."
PRV_91.,"Леса и их элементы:
а) должны обеспечивать безопасность работников во время их монтажа, эксплуатации и демонтажа, при этом монтаж и демонтаж лесов должен производиться работниками с применением систем обеспечения безопасности работ на высоте;
б) должны быть подготовлены и смонтированы в соответствии с паспортом изготовителя, иметь размеры, прочность и устойчивость, соответствующие их назначению;
в) металлические леса должны быть заземлены. При установке на открытом воздухе металлические и деревянные леса должны быть оборудованы грозозащитными устройствами.
г) перила и другие предохранительные сооружения, платформы, настилы, консоли, подпорки, поперечины, лестницы и пандусы должны легко устанавливаться и надежно крепиться;
д) должны содержаться и эксплуатироваться таким образом, чтобы исключались их разрушение, потеря устойчивости;
е) должны иметь идентификационную маркировку с наименованием изготовителя, нанесенную способом, позволяющим ее сохранить в течение всего срока службы элемента.
В местах подъема работников на леса и подмости должны размещаться плакаты с указанием схемы их размещения и величин допускаемых нагрузок; места расположения анкерных точек и (или) анкерных линий для присоединения соединительных и соединительно-амортизирующих подсистем работников, если это не определено технической документацией изготовителя лесов; а также схемы эвакуации работников в случае возникновения аварийной ситуации."
PRV_92.,"Для выполнения работ с лесов высотой 6 м и более должно быть не менее двух настилов - рабочий (верхний) и защитный (нижний), а каждое рабочее место на лесах, примыкающих к зданию или сооружению, должно быть, кроме того, защищено сверху настилом, расположенным на расстоянии по высоте не более 2 м от рабочего настила.
Работы в нескольких ярусах по одной вертикали без промежуточных защитных настилов между ними не допускаются.
В случаях, когда выполнение работ, движение людей и транспорта под лесами и вблизи них не предусматривается, устройство защитного (нижнего) настила необязательно."
PRV_93.,"При многоярусном характере производства работ для защиты от падающих объектов платформы, настилы, подмости, лестницы лесов оборудуют инвентарными защитными экранами достаточных размеров."
PRV_94.,"Леса оборудуются лестницами или трапами для подъема и спуска людей, расположенными на расстоянии не более 40 м друг от друга. На лесах длиной менее 40 м устанавливается не менее двух лестниц или трапов. Верхний конец лестницы или трапа закрепляется за поперечины лесов.
Проемы в настиле лесов для выхода с лестниц ограждаются. Угол наклона лестниц должен быть не более 75° к горизонтальной поверхности. Наклон трапа должен быть не более 1:3."
PRV_95.,"Для подъема груза на леса используют блоки, укосины и другие средства малой механизации, которые следует крепить согласно технологическим картам или ППР на высоте.
Проемы для перемещения грузов должны иметь всесторонние ограждения."
PRV_96.,"Вблизи проездов средства подмащивания устанавливают на расстоянии не менее 0,6 м от габарита транспортных средств.
При установке средств подмащивания на проезжей части дороги необходимо выставить предупреждающие знаки на расстоянии 50 м против направления движения транспорта.
В темное время суток должны включаться красные габаритные огни."
PRV_97.,"Леса высотой более 4 м от уровня земли, пола или площадки, на которой установлены стойки лесов, допускаются к эксплуатации после приемки комиссией с оформлением акта.
Результаты приемки лесов утверждаются главным инженером (техническим директором) организации, принимающей леса в эксплуатацию или непосредственно руководителем организации (индивидуальным предпринимателем). Допускается утверждение результатов приемки лесов, сооружаемых подрядной организацией для своих нужд, начальником участка (цеха) этой организации.
До утверждения результатов приемки лесов работа с лесов не допускается."
PRV_98.,Подмости и леса высотой до 4 м допускаются к эксплуатации после их приемки ответственным руководителем работ на высоте с отметкой в журнале приема и осмотра лесов и подмостей (рекомендуемый образец предусмотрен приложением N 6 к Правилам).
PRV_99.,"При приемке лесов и подмостей проверяется на соответствие проекту, типовым схемам применения и паспорту изготовителя: наличие связей и креплений, обеспечивающих устойчивость, прочность узлов крепления отдельных элементов; исправность рабочих настилов и ограждений; отсутствие деформаций сборочных элементов, видимых повреждений, вертикальность стоек; надежность опорных площадок и наличие заземления (для металлических лесов)."
PRV_100.,"Осмотры лесов проводят регулярно в сроки, предусмотренные паспортом изготовителя на леса, а также после воздействия экстремальных погодных или сейсмических условий, других обстоятельств, которые могут повлиять на их прочность и устойчивость. При обнаружении деформаций лесов они должны быть устранены и приняты повторно в соответствии с требованиями пунктов 97 - 98 Правил.
Ответственный исполнитель (производитель) работ осматривает леса перед началом работ каждой рабочей смены, лицо, назначенное ответственным за организацию и безопасное проведение работ на высоте, осматривает леса не реже 1 раза в 10 рабочих смен.
Текущий осмотр люльки осуществляется ежедневно перед началом выполнения работ непосредственно работником, осуществляющим ее эксплуатацию.
Периодический осмотр в процессе эксплуатации люльки проводиться лицом, ответственным за ее безопасную эксплуатацию, через каждые 10 рабочих дней.
Результаты осмотра записываются в журнале приема и осмотра лесов и подмостей."
PRV_101.,"При осмотре лесов и подмостей устанавливается:
а) наличие или отсутствие дефектов и повреждений элементов конструкции лесов (подмостей) и анкерных устройств, влияющих на их прочность и устойчивость;
б) прочность и устойчивость лесов (подмостей);
в) наличие необходимых ограждений;
г) пригодность лесов (подмостей) для дальнейшей работы."
PRV_102.,"Леса, с которых в течение месяца и более работа не производилась, перед возобновлением работ подвергают приемке повторно."
PRV_103.,"Настилы и лестницы лесов и подмостей необходимо периодически в процессе работы и ежедневно после окончания работы очищать от мусора, а в зимнее время - очищать от снега и наледи и при необходимости посыпать песком."
PRV_104.,Работа со случайных подставок не допускается.
PRV_105.,"Если для производства работ необходима частичная разборка лесов, (временное снятие верхнего (среднего) элемента ограждения, отдельных настилов), то это изменение конструкции лесов должно быть предусмотрено проектом, а при организации работ должны соблюдаться требования согласно пункту 7 Правил."
PRV_106.,"Сборка и разборка лесов производятся по наряду-допуску с соблюдением последовательности, предусмотренной ППР на высоте. Работники, участвующие в сборке и разборке лесов, должны пройти соответствующее обучение безопасным методам и приемам работ и должны быть проинструктированы о способах и последовательности производства работ и мерах безопасности.
Во время разборки лесов, примыкающих к зданию, все дверные проемы первого этажа и выходы на балконы всех этажей в пределах разбираемого участка закрываются.
Доступ для посторонних лиц (непосредственно не занятых на данных работах) в зону, где устанавливаются или разбираются леса и подмости, должен быть закрыт."
PRV_107.,"Леса, расположенные в местах проходов в здание, оборудуются защитными козырьками со сплошной боковой обшивкой для защиты от случайно упавших сверху предметов.
Защитные козырьки должны выступать за леса не менее чем на 1,5 м и иметь наклон в 20° в сторону лесов.
Высота проходов должна быть не менее 1,8 м."
PRV_108.,"При организации массового прохода в непосредственной близости от средств подмащивания места прохода людей оборудуются сплошным защитным навесом, а фасад лесов закрывается защитной сеткой с ячейкой размером не более 5 x 5 мм."
PRV_109.,"При эксплуатации передвижных средств подмащивания (в том числе шарнирно-рычажных вышек) необходимо выполнять следующие требования:
а) уклон поверхности, по которой осуществляется перемещение средств подмащивания в поперечном и продольном направлениях, не должен превышать величин, указанных в паспорте или инструкции изготовителя для этого типа средств подмащивания;
б) передвижение средств подмащивания при скорости ветра более 10 м/с не допускается;
г) при скорости ветра более 12 м/с или температуре наружного воздуха ниже -20 °C работа на шарнирно-рычажной вышке не допускается, секции вышки должны быть опущены.
д) запрещается: перегружать средства подмащивания, выполнять ремонтные операции, открывать двери средств подмащивания и находиться на стреловых частях во время работы на высоте, работать при отсутствии или неправильной установке страховочной гайки в приводах подъема секции."
PRV_110.,"Подвесные леса, лестницы, подмости и люльки после их монтажа (сборки, изготовления) могут быть допущены к эксплуатации после соответствующих испытаний.
В случаях многократного использования подвесных лесов или подмостей они могут быть допущены к эксплуатации без испытания при условии, что конструкция, на которую подвешиваются леса (подмости), проверена на нагрузку, превышающую расчетную не менее чем в два раза, а закрепление лесов осуществлено типовыми узлами (устройствами), выдерживающими необходимые испытания.
Результаты испытаний отражаются в журнале приема и осмотра лесов и подмостей."
PRV_111.,"Подвесные леса и люльки во избежание раскачивания должны быть прикреплены к несущим частям здания (сооружения) или конструкциям.
Консоли для подвесных люлек должны крепиться в соответствии с проектом производства работ или инструкцией по эксплуатации люльки.
Запрещается опирать консоли на карнизы зданий и парапетные стенки из ветхой кладки.
Материалы, инвентарь и тара должны размещаться в люльке так, чтобы по всей ее длине оставался свободный проход.
Нахождение в люльке более двух работников запрещается."
PRV_112.,"При эксплуатации люлек запрещается:
1) соединение двух люлек в одну;
2) переход на высоте из одной люльки в другую;
3) применение бочек с водой в качестве балласта для лебедок;
4) допуск к лебедкам посторонних лиц;
5) использовать люльки (кабины) при ветре, скорость которого превышает 10 м/с, плохой видимости (при сильном дожде, снеге, тумане), обледенении, а также в любых других условиях, которые могут поставить под угрозу безопасность людей;
6) вход в люльку и выход из нее допускаются только при нахождении люльки на земле;
7) люльки и передвижные леса, с которых в течение смены работа не производится, должны быть опущены на землю, с подъемных ручных лебедок сняты рукоятки, будки электрических лебедок должны быть заперты на замок."
PRV_113.,"Ежедневно перед работой проводится осмотр и проверяется состояние люлек, передвижных лесов и канатов, проводится испытание по имитации обрыва рабочего каната."
PRV_114.,"Безопасность работников при работе на высоте в подвесных люльках в дополнение к общим требованиям, предъявляемым к работе на лесах, должна обеспечиваться использованием системы безопасности необходимой в зависимости от условий производства работ системы обеспечения безопасности работ на высоте."
PRV_115.,Нахождение работников на перемещаемых лесах не допускается.
PRV_116.,"Системы обеспечения безопасности работ на высоте, предусмотренные приложением N 10 к Правилам, делятся на следующие виды: удерживающие системы, системы позиционирования, страховочные системы, системы спасения и эвакуации."
PRV_117.,"Системы обеспечения безопасности работ на высоте должны:
а) соответствовать существующим условиям на рабочих местах, характеру и виду выполняемой работы;
б) учитывать эргономические требования и состояние здоровья работника;
в) с помощью систем регулирования и фиксирования, а также подбором размерного ряда соответствовать, росту и размерам работника."
PRV_118.,"Системы обеспечения безопасности работ на высоте предназначены:
а) для удерживания работника таким образом, что падение с высоты предотвращается (системы удерживания или позиционирования);
б) для безопасной остановки падения (страховочная система) и уменьшения тяжести последствий остановки падения;
в) для спасения и эвакуации."
PRV_119.,"Работодатель на основании результатов оценки рисков и специальной оценки условий труда и процедуры обеспечения работников СИЗ и коллективной защиты СУОТ обеспечивает работника системой обеспечения безопасности работ на высоте, объединяя в качестве элементов, компонентов или подсистем, совместимые СИЗ от падения с высоты."
PRV_120.,"Средства коллективной и индивидуальной защиты работников должны использоваться по назначению в соответствии с требованиями, излагаемыми в инструкциях изготовителя, нормативной технической документации, введенной в действие в установленном порядке. Использование средств защиты, на которые не имеется технической документации (инструкции), не допускается."
