punkt,text
PRV_192.,"Оборудование, механизмы, ручной механизированный и другой инструмент, инвентарь, приспособления и материалы, используемые при выполнении работы на высоте, должны применяться с обеспечением мер безопасности, исключающих их падение (размещение в сумках и подсумках, крепление, строповка, размещение на достаточном удалении от границы перепада высот или закрепление к страховочной привязи работника).
Инструменты, инвентарь, приспособления и материалы весом более 10 кг должны быть подвешены на отдельном канате с независимым анкерным устройством."
PRV_193.,"После окончания работы на высоте оборудование, механизмы, средства малой механизации, ручной инструмент должны быть сняты с высоты."
PRV_194.,Выполнение работ с люлек строительных подъемников (вышки) и фасадных подъемников в соответствии с осмотром рабочего места осуществляется с использованием удерживающих или страховочных систем.
PRV_195.,"Рабочие места грузоподъемных механизмов, расположенные выше 5 м, должны обеспечиваться средствами эвакуации с высоты (средствами самоспасения), предусмотренными приложением N 10 к Правилам."
PRV_196.,Места установки грузоподъемных механизмов и режимы их работы должны соответствовать ППР на высоте или технологической карте.
PRV_197.,"На платформе или клети подъемника, предназначенного или разрешенного для подъема людей, на видном месте должно быть указано максимальное количество человек, поднимаемых одновременно."
PRV_198.,"Груз (каждая часть груза) в процессе подъема, перемещения, опускания должен иметь надежную строповку или опору, исключающую возможность падения груза (части груза)."
PRV_199.,"Масса груза, подлежащего подъему, должна быть определена до начала его подъема."
PRV_200.,"Для грузов, у которых имеются петли, цапфы, рымы, разрабатываются схемы их строповки. Для грузов, не имеющих таких устройств, разрабатываются способы строповки, которые должны быть указаны в технологических картах или в ППР на высоте. Схемы строповки наиболее часто встречающихся грузов вывешиваются на рабочих местах."
PRV_201.,"Строповка поднимаемого груза за выступы, штурвалы, штуцера и другие устройства, не рассчитанные для его подъема, не допускается."
PRV_202.,"Длинномерные грузы (балки, колонны) при подъеме и спуске должны направляться с использованием канатных, тросовых оттяжек."
PRV_203.,"При приеме или отправлении груза с лестничных и других площадок работы организуются так и площадки оборудуются таким образом, чтобы исключалась необходимость работникам наклоняться наружу за ограждения площадок."
PRV_204.,При подъеме грузов в местах с регулярным движением транспортных средств устанавливаются ограждения и оборудуется объездной путь или принимаются меры для остановки движения транспортных средств при подъеме единичных грузов.
PRV_205.,"Из зоны работ по подъему и перемещению грузов должны быть удалены лица, не имеющие прямого отношения к производимым работам."
PRV_206.,В зоне перемещения грузов все проемы должны быть закрыты или ограждены и должны быть вывешены предупреждающие знаки безопасности.
PRV_207.,"Опускать грузы разрешается на предварительно подготовленное место с исключением их падения, опрокидывания или сползания. Для удобства извлечения стропов из-под груза на месте его установки необходимо уложить прочные подкладки."
PRV_208.,"Опускать грузы на перекрытия, опоры и площадки без предварительной проверки прочности несущих конструкций не допускается."
PRV_209.,"Не допускается при работе грузоподъемными механизмами:
а) оставлять груз в подвешенном состоянии;
б) поднимать, опускать, перемещать людей не предназначенными для этих целей грузоподъемными механизмами;
в) производить подъем, перемещение грузов при недостаточной освещенности;
г) подтаскивать груз при наклонном положении грузовых канатов;
д) поднимать груз, масса которого превышает грузоподъемность механизма, поднимать примерзший или защемленный груз, груз неизвестной массы;
е) оттягивать груз во время его подъема, перемещения или опускания, а также выравнивать его положение собственной массой;
ж) освобождать с помощью грузоподъемного механизма защемленные грузом стропы, канаты, цепи;
з) работать с неисправными или выведенными из строя приборами безопасности и тормозной системы."
PRV_210.,"В случае неисправности механизма, когда нельзя опустить груз, место под подвешенным грузом ограждается и вывешиваются плакаты ""Опасная зона"", ""Проход закрыт""."
PRV_211.,"Перед подъемом груз необходимо приподнять на высоту не более 200 - 300 мм для проверки правильности строповки, равномерности натяжения стропов, устойчивости грузоподъемного механизма и надежности действия тормоза, и только после этого груз следует поднимать на требуемую высоту. Для исправления строповки груз должен быть опущен."
PRV_212.,"Подъем груза необходимо производить плавно, без рывков и раскачивания, не допуская его задевания за окружающие предметы, не допуская закручивания стропов."
PRV_213.,"При работе с лебедками с ручным рычажным приводом не допускается:
а) находиться в плоскости качания рычага и под поднимаемым грузом;
б) применять удлиненный (против штатного) рычаг;
в) переводить рычаг из одного крайнего положения в другое рывками."
PRV_214.,"При работе перемещаемый груз должен надежно крепиться к крюку. Движение рукоятки обратного хода должно быть плавным, без рывков и заеданий; тяговый механизм и канат должны находиться на одной прямой."
PRV_215.,"Место установки, способ крепления лебедок, а также расположение блоков должны быть указаны в ППР на высоте."
PRV_216.,"Место установки лебедки необходимо выбирать исходя из следующих требований:
а) лебедка должна находиться вне зоны производства работ по подъему и перемещению груза;
б) место установки лебедки должно обеспечивать обзор зоны работы и визуальное наблюдение за поднимаемым (перемещаемым) грузом;
в) должно быть обеспечено надежное закрепление лебедки, крепление и правильное направление намотки каната на барабан лебедки;
г) канат, идущий к лебедке, не должен пересекать дорог и проходов для людей."
PRV_217.,"При установке лебедки в здании лебедка должна быть закреплена за колонну здания, за железобетонный или металлический ригель его перекрытия и другие элементы стены стальным канатом. При этом диаметр и число ветвей каната должны быть рассчитаны по грузоподъемности лебедки с коэффициентом запаса прочности не менее 6. Крепление должно производиться за раму лебедки, приваривать раму не допускается."
PRV_218.,При установке лебедки на земле ее необходимо крепить за якорь или через упор с противовесом. Устойчивость лебедки должна проверяться расчетом.
PRV_219.,"Лебедки, устанавливаемые на земле и применяемые для перемещения подъемных подмостей, загружаются балластом весом, превышающим тяговое усилие лебедки не менее чем в два раза. Балласт закрепляется на раме лебедки. Количество витков каната на барабане лебедки при нижнем положении груза должно быть не менее двух."
PRV_220.,"Приваривать ручные рычажные лебедки к площадкам для обслуживания оборудования, крепить их к трубопроводам и их подвескам не допускается."
PRV_221.,"Лебедки, при осмотре которых обнаружены дефекты, к работе не допускаются.
Не допускается работа лебедок:
а) при ненадежном закреплении лебедки на рабочем месте;
б) при неисправности тормозов;
в) при неисправности привода;
г) при отсутствии ограждения привода;
д) при ненадежном закреплении каната на барабане или неправильной его навивке на барабан."
PRV_222.,"Не допускаются ручное управление лебедкой без рукавиц, ремонт или подтяжка крепежных деталей во время работы лебедки."
PRV_223.,Канаты в местах присоединения их к люльке и барабану лебедки должны быть прочно закреплены. Движение канатов при подъеме и опускании люлек должно быть свободным. Трение канатов о выступающие конструкции не допускается.
PRV_224.,"Количество работников, обслуживающих лебедки с ручным приводом, рассчитывается исходя из конкретных условий работы и расчетного усилия, прилагаемого к рукоятке лебедки (из расчета усилия, прилагаемого к рукоятке лебедки одним работником в 120 Н (12 кгс) и до 200 Н (20 кгс) при кратковременном приложении)."
PRV_225.,"Лебедки с электрическим приводом, предназначенные для подъема людей, оснащаются колодочным тормозом, автоматически действующим при отключении электродвигателя. Коэффициент запаса торможения должен быть не менее 2."
PRV_226.,"Применение фрикционных и кулачковых муфт, а также фрикционной и ременной передач для связи вала электродвигателя с валом барабана у лебедок, предназначенных для подъема людей, не допускается."
PRV_227.,"Пусковые аппараты должны быть снабжены ключ-марками, либо запираться в ящик для исключения несанкционированного управления лицами, не допущенными к управлению ПС с пола.
Пусковые аппараты ручного управления талями должны подвешиваться на стальном тросе такой длины, чтобы можно было управлять механизмом, находясь на безопасном расстоянии от поднимаемого груза. При расположении аппарата управления ниже 0,5 м от пола его следует подвешивать на крючок, укрепленный на тросе на высоте 1 - 1,5 м от пола.
Пусковые аппараты должны быть снабжены ключ-марками, либо запираться в ящик для исключения несанкционированного управления лицами, не допущенными к управлению ПС с пола."
PRV_228.,"Техническое освидетельствование талей проводится нагрузками и в сроки, которые указаны в документации. Рекомендуемый образец журнала учета и осмотра такелажных средств, механизмов и приспособлений предусмотрен приложением N 7 к Правилам."
PRV_229.,Подтаскивание груза крючком или оттяжка поднимаемого груза электрическими талями не допускается. Отклонение грузового каната от вертикали при подъеме груза допускается не более чем на 5°.
PRV_230.,"При сборке полиспастов и при подъеме груза необходимо следить за тем, чтобы подвижные и неподвижные обоймы были параллельны друг другу. Косое положение одного блока относительно другого может привести к соскальзыванию каната с блока."
PRV_231.,"Рекомендуемые узлы и полиспасты, используемые при транспортировке грузов, предусмотрены приложением N 15 к Правилам."
PRV_232.,"Тяговый (сбегающий) конец каната должен быть направлен к лебедке так, чтобы он не вызывал перекоса блока полиспаста."
PRV_233.,"Отводные блоки рекомендуется применять разъемной конструкции, позволяющей запасовывать канат в блок в любом месте по его длине. Располагать отводные блоки необходимо так, чтобы проходящий через них тяговый конец каната не имел косого набегания на блок полиспаста."
PRV_234.,Применять при оснастке полиспастов блоки разной грузоподъемности не допускается.
PRV_235.,При подборе блока по грузоподъемности необходимо проверять соответствие размеров ручья ролика диаметру каната. Диаметр ручья ролика должен быть больше диаметра каната на 1 - 3 мм.
PRV_236.,При подвешивании верхних неподвижных блоков полиспастов необходимо избегать бокового опирания обоймы верхнего блока на ригель или балку. Перекос роликов верхнего блока по отношению к канату не допускается.
PRV_237.,"При оснастке полиспастов должны соблюдаться следующие требования:
а) при четном числе ниток полиспаста конец каната следует крепить к неподвижному блоку;
б) при нечетном числе ниток полиспаста конец каната следует крепить к подвижному блоку."
PRV_238.,"Технические освидетельствования блоков и полиспастов проводятся нагрузками, указанными в документации изготовителя."
PRV_239.,Работать с канатами без СИЗ рук не допускается.
PRV_240.,"Стальные канаты, которыми оснащены грузоподъемные механизмы, проходят технические освидетельствования, включая испытания под нагрузкой, совместно с этими механизмами."
PRV_241.,"Канаты и стропы подлежат осмотру до и после использования, а также проведению обслуживания и периодических проверок в соответствии с эксплуатационной документацией (инструкцией)."
PRV_242.,"Требования безопасности к цепям:
а) коэффициент запаса прочности сварных и штампованных грузовых цепей и цепей для стропов должен быть не меньше указанного в документации изготовителя;
б) сращивание цепей допускается путем электро- или кузнечно-горновой сварки новых вставленных звеньев или с помощью специальных соединительных звеньев; после сращивания цепь осматривается и испытывается нагрузкой в соответствии с документацией."
PRV_243.,"Монтаж сборно-монолитных, крупнопанельных и многоэтажных конструкций производится по ППР на высоте, в котором дополнительно к содержанию ППР на высоте, предусмотренному пунктами 36 - 43 Правил, должны быть отражены:
а) специфика монтируемых конструкций;
б) технические способы их безопасной установки, способы подъема и установки монтируемых несущих конструкций, исключающих их дисбаланс, неустойчивость или перекашивание в процессе этих операций;
в) указание позиции и расположения арматуры в элементах конструкции;
г) допустимые нагрузки на элементы и конструкцию в целом;
д) требуемое применение лестниц, настилов, подмостей, платформ, подъемных клетей, монтажных люлек и других аналогичных средств, ограждений, мобильных рабочих платформ."
PRV_244.,"Подъем несущих конструкций и их частей должен производиться способами, согласно ППР на высоте, исключающими их случайное вращение."
PRV_245.,"При выполнении плотницких работ на высоте опасностями и их источниками являются:
а) острые кромки, заусенцы и шероховатости на поверхности заготовок, инструментов и оборудования;
б) движущиеся машины и механизмы."
PRV_246.,"Укладка балок междуэтажных и чердачных перекрытий, подбивка потолков, а также укладка накатов с приставных лестниц запрещаются. Указанные работы необходимо выполнять с подмостей."
PRV_247.,"Щиты или доски временных настилов, уложенные на балки междуэтажных или чердачных перекрытий, необходимо соединять впритык, а место их стыкования располагать по осям балок."
