punkt,text
PRV_45.,"Не допускается выполнение работ на высоте без оформления наряда-допуска с указанием в пункте 3 наряда-допуска соответствующих мероприятий по безопасности работ на высоте при указанных в пункте 4 наряда-допуска особых условий проведения работ, в том числе:
а) в открытых местах при скорости воздушного потока (ветра) 15 м/с и более;
б) при грозе или тумане, исключающем видимость в пределах фронта работ, а также при гололеде с обледенелых конструкций и в случаях нарастания стенки гололеда на проводах, оборудовании, инженерных конструкциях (в том числе опорах линий электропередачи), деревьях;
в) при монтаже (демонтаже) конструкций с большой парусностью при скорости ветра 10 м/с и более."
PRV_46.,"Должностное лицо, ответственное за организацию и безопасное проведение работ на высоте, обязано:
а) организовать разработку документации по охране труда при работах на высоте; плана мероприятий по эвакуации и спасению работников при возникновении аварийной ситуации и при проведении спасательных работ; разработку, утверждение и введение в действие технологических карт на производство работ на высоте или ППР на высоте; оформление нарядов-допусков;
б) организовывать хранение, выдачу средств коллективной и индивидуальной защиты в соответствии с указаниями эксплуатационной документации (инструкции) изготовителя, а также обеспечить своевременность их обслуживания, периодическую проверку, браковку;
в) организовать обучение работников безопасным методам и приемам выполнения работ на высоте, периодической проверки знаний безопасных методов и приемов выполнения работ на высоте, стажировки, проведение соответствующих инструктажей по охране труда;
г) вести личные книжки учета работ на высоте с применением систем канатного доступа."
PRV_47.,"Работодатель для обеспечения безопасности работ, проводимых на высоте, должен организовать:
а) правильный выбор и использование средств защиты;
б) соблюдение указаний маркировки средств защиты;
в) обслуживание и периодические проверки средств защиты, указанных в эксплуатационной документации (инструкции) изготовителя."
PRV_48.,"Работодатель до начала выполнения работ на высоте должен утвердить перечень работ на высоте, выполняемых с оформлением наряда-допуска (далее - Перечень), с обязательным включением в него работ, указанных в пункте 7 Правил."
PRV_49.,"В исключительных случаях (предупреждение аварии, устранение угрозы жизни работников, ликвидация последствий аварий и стихийных бедствий) работы на высоте, включенные в Перечень, могут быть начаты без оформления наряда-допуска под руководством работников, назначаемых работодателем ответственными за безопасную организацию и проведение работ на высоте.
Если указанные работы выполняются более суток, оформление наряда-допуска должно быть произведено в обязательном порядке."
PRV_50.,"Наряд-допуск определяет место производства работ на высоте, их содержание, условия проведения работ, время начала и окончания работ, состав бригады, выполняющей работы, ответственных лиц при выполнении этих работ. Если работы на высоте проводятся одновременно с другими видами работ, требующими оформления наряда-допуска, то может оформляться один наряд-допуск с обязательным включением в него сведений о производстве работ на высоте и назначением лиц, ответственных за организацию и безопасное проведение работ на высоте, и обеспечением условий и порядка выполнения работ по наряду-допуску в соответствии с требованиями нормативного правового акта его утвердившего."
PRV_51.,"Если работы, указанные в Перечне, проводятся одновременно с другими видами работ, требующими разработки ППР в соответствии с другими нормативными правовыми актами, то может разрабатываться один ППР с обязательным включением в него сведений, предусмотренных пунктами 36 - 42 Правил."
PRV_52.,При выполнении работ на высоте в охранных зонах сооружений или коммуникаций наряд-допуск выдается при наличии письменного разрешения владельца этого сооружения или коммуникации.
PRV_53.,"Для организации безопасного производства работ на высоте, выполняемых с оформлением наряда-допуска, назначаются:
а) должностные лица, имеющие право выдавать наряд-допуск, из числа руководителей и специалистов;
б) ответственный руководитель работ из числа руководителей и специалистов;
в) ответственный исполнитель (производитель) работ из числа рабочих (бригадиров, звеньевых и высококвалифицированных рабочих).
Вышеуказанные должностные лица должны пройти соответствующую специальную подготовку."
PRV_54.,"Должностные лица, выдающие наряд-допуск, обязаны:
а) определить в ППР на высоте технико-технологические мероприятия обеспечения безопасности работников, места производства работ;
б) назначить ответственного руководителя работ;
в) определить число нарядов-допусков, выдаваемых на одного ответственного руководителя работ, для одновременного производства работ;
г) назначить ответственного исполнителя (производителя) работ;
д) определить место производства и объем работ, указывать в наряде-допуске используемое оборудование и средства механизации (или указать ссылку на пункт ППР или технологической карты);
е) выдать ответственному руководителю работ два экземпляра наряда-допуска, о чем произвести запись в журнале учета работ по наряду-допуску (рекомендуемый образец предусмотрен приложением N 5 к Правилам);
ж) ознакомить ответственного руководителя работ с прилагаемой к наряду-допуску проектной, технологической документацией, схемой ограждения;
з) организовывать контроль за выполнением мероприятий по обеспечению безопасности при производстве работ, предусмотренных нарядом-допуском;
и) принимать у ответственного руководителя работ по завершении работы закрытый наряд-допуск с записью в журнале учета работ по наряду-допуску."
PRV_55.,"Должностные лица, выдающие наряд-допуск, являются ответственными за:
а) своевременное, правильное оформление и выдачу наряда-допуска;
б) указанные в наряде-допуске мероприятия, обеспечивающие безопасность работников при производстве работ на высоте;
в) состав бригады и назначение работников, ответственных за организацию и безопасное проведение работ на высоте;
г) организацию контроля выполнения указанных в наряде-допуске мероприятий безопасности;
д) хранение и учет нарядов-допусков."
PRV_56.,"Ответственный руководитель работ обязан:
а) получить наряд-допуск на производство работ у должностного лица, выдающего наряд-допуск, о чем производится запись в журнале учета работ по наряду-допуску;
б) ознакомиться под подпись с ППР на высоте, проектной, технологической документацией, планом мероприятий при аварийной ситуации и при проведении спасательных работ, с необходимыми для работы журналами учета и обеспечивать наличие этой документации при выполнении работ;
в) проверить укомплектованность членов бригады, указанных в наряде-допуске, инструментом, материалами, средствами защиты, знаками, ограждениями, а также проверять у членов бригады наличие и сроки действия удостоверений о допуске к работам на высоте;
г) дать указание ответственному исполнителю (производителю) работ по подготовке и приведению в исправность указанных в наряде-допуске инструментов, материалов, средств защиты, знаков, ограждений;
д) по прибытии на место производства работ организовать, обеспечить и контролировать выполнение технических мероприятий по подготовке рабочего места к началу работы, комплектность выданных в соответствии с нарядом-допуском и (или) ППР на высоте или в технологических картах СИЗ от падения с высоты, включая аварийный комплект спасательных и эвакуационных средств, комплектность средств оказания первой помощи, правильное расположение знаков безопасности, защитных ограждений и ограждений мест производства работ;
е) проверять соответствие состава бригады составу, указанному в наряде-допуске;
ж) доводить до сведения членов бригады информацию о мероприятиях по безопасности производства работ на высоте, проводить целевой инструктаж членов бригады под их подпись в наряде-допуске;
з) при проведении целевого инструктажа разъяснять членам бригады порядок производства работ, порядок действий в аварийных и чрезвычайных ситуациях, доводить до их сведения их права и обязанности;
и) после целевого инструктажа проводить проверку полноты усвоения членами бригады мероприятий по безопасности производства работ на высоте;
к) организовать и обеспечить выполнение мероприятий по безопасности работ на высоте, указанных в наряде-допуске, при подготовке рабочего места к началу работы, производстве работы и ее окончании;
л) допустить бригаду к работе по наряду-допуску непосредственно на месте выполнения работ;
м) остановить работы при выявлении дополнительных вредных и опасных производственных факторов (в соответствии с пунктом 54 Правил), не предусмотренных выданным нарядом-допуском, а также при изменении состава бригады (в соответствии с пунктом 54 Правил) до оформления нового наряда-допуска;
н) организовать в ходе выполнения работ регламентируемые перерывы и допуск работников к работе после окончания перерывов;
о) по окончании работы организовать уборку материалов, инструментов, приспособлений, ограждений, мусора и других предметов, вывод членов бригады с места работы."
PRV_57.,"Ответственный руководитель работ является ответственным за:
а) выполнение всех указанных в наряде-допуске мероприятий по безопасности и их достаточность;
б) принимаемые им дополнительные меры безопасности, необходимые по условиям выполнения работ;
в) полноту и качество целевого инструктажа членов бригады;
г) организацию безопасного ведения работ на высоте."
PRV_58.,"Ответственный исполнитель (производитель) работ является членом бригады. Он выполняет распоряжения ответственного руководителя работ. С момента допуска бригады к работе ответственный исполнитель (производитель) работ должен постоянно находиться на рабочем месте и осуществлять непрерывный контроль за работой членов бригады, выполнением ими мер безопасности и соблюдением технологии производства работ. Ответственный исполнитель (производитель) работ в случае временного ухода с места производства работ и отсутствия возможности передать исполнение своих обязанностей на ответственного руководителя работ или работника, имеющего право выдачи наряда-допуска (при наличии у них допуска к проведению работ, соответствующего работнику 2 группы), обязан удалить бригаду с места работы.
На время своего временного отсутствия на рабочем месте ответственный исполнитель (производитель) работ должен передать наряд-допуск заменившему его работнику с соответствующей записью в пункте 7 наряда-допуска с указанием времени передачи наряда-допуска."
PRV_59.,"Ответственный исполнитель (производитель) работ обязан:
а) проверить в присутствии ответственного руководителя работ подготовку рабочих мест, выполнение мер безопасности, предусмотренных нарядом-допуском, наличие у членов бригады необходимых в процессе работы и указанных в наряде-допуске СИЗ, оснастки и инструмента, расходных материалов;
б) опросить исполнителей работ об их самочувствии в рамках процедур СУОТ об организации и проведения наблюдения за состоянием здоровья работников;
в) указать каждому члену бригады его рабочее место;
г) не допускать отсутствия членов бригады на местах производства работ без разрешения ответственного исполнителя (производителя) работ, выполнения работ, не предусмотренных нарядом-допуском;
д) выводить членов бригады с места производства работ на время перерывов в ходе рабочей смены;
е) возобновлять работу бригады после перерыва только после личного осмотра рабочего места;
ж) по окончании работ обеспечить уборку материалов, инструмента, приспособлений, ограждений, мусора и других предметов;
з) вывести членов бригады с места производства работ по окончании рабочей смены."
PRV_60.,"Член бригады обязан:
а) выполнять порученную ему работу;
б) осуществлять непрерывную визуальную связь, а также связь голосом или радиопереговорную связь с другими членами бригады;
в) уметь пользоваться СИЗ, инструментом и техническими средствами, обеспечивающими безопасность работников;
г) лично производить осмотр выданных СИЗ перед и после каждого их использования;
д) содержать в исправном состоянии СИЗ, инструмент и технические средства;
е) уметь оказывать первую помощь пострадавшим на производстве;
ж) знать свои действия при возникновении аварийной ситуации."
PRV_61.,"Работник, приступающий к выполнению работы по наряду-допуску, должен быть ознакомлен:
а) с должностной инструкцией и (или) инструкцией по охране труда по профессии, виду выполняемых работ, с локальными нормативными актами по охране труда в объеме, соответствующем выполняемой работе;
б) с условиями и состоянием охраны труда на рабочем месте, с существующим риском причинения ущерба здоровью, с правилами и приемами безопасного выполнения работы;
в) с мерами по защите от воздействия вредных и опасных производственных факторов;
г) с наличием и состоянием средств коллективной и индивидуальной защиты, с инструкциями по их применению;
д) с режимом выполнения предстоящей работы.
Каждый член бригады должен выполнять указания ответственного исполнителя (производителя) работ, а также требования инструкций по охране труда по профессии и по видам работ, к которым он допущен."
PRV_62.,"До начала выполнения работ по наряду-допуску для выявления риска, связанного с возможным падением работника, необходимо провести осмотр рабочего места на предмет соответствия Правилам (далее - осмотр рабочего места).
Осмотр рабочего места проводится ответственным руководителем работ в присутствии ответственного исполнителя (производителя) работ.
При осмотре рабочего места должны выявляться причины возможного падения работника, в том числе:
а) ненадежность анкерных устройств;
б) наличие хрупких (разрушаемых) поверхностей, открываемых или незакрытых люков, отверстий в зоне производства работ;
в) наличие скользкой рабочей поверхности, имеющей неогражденные перепады высоты;
г) возможная потеря работником равновесия при проведении работ со строительных лесов, с подмостей, стремянок, приставных лестниц, в люльках подъемника, нарушение их устойчивости, их разрушение или опрокидывание;
д) разрушение конструкции, оборудования или их элементов при выполнении работ непосредственно на них."
