punkt,text
PRV_1.,Правила по охране труда при работе на высоте (далее - Правила) устанавливают государственные нормативные требования по охране труда и регулируют порядок действий работодателя и работника при организации и проведении работ на высоте.
PRV_2.,"Требования Правил распространяются на работников и работодателей - физических или юридических лиц, вступивших в трудовые отношения с работниками, выполняющими работы на высоте (далее - работодатели, работники)."
PRV_3.,"К работам на высоте относятся работы, при которых:
а) существуют риски, связанные с возможным падением работника с высоты 1,8 м и более, в том числе:
при осуществлении работником подъема на высоту более 5 м, или спуска с высоты более 5 м по лестнице, угол наклона которой к горизонтальной поверхности составляет более 75°;
при проведении работ на площадках на расстоянии ближе 2 м от неогражденных перепадов по высоте более 1,8 м, а также, если высота защитного ограждения площадок менее 1,1 м;
б) существуют риски, связанные с возможным падением работника с высоты менее 1,8 м, если работа проводится над машинами или механизмами, поверхностью жидкости или сыпучих мелкодисперсных материалов, выступающими предметами."
PRV_4.,"Работодатель, исходя из специфики своей деятельности и характеристик объекта, обязан в рамках процедуры управления профессиональными рисками системы управления охраной труда (далее - СУОТ) провести оценку профессиональных рисков, связанных с возможным падением работника с высоты в соответствии с классификацией работ на высоте, указанной в пункте 3 Правил.
Работы, отнесенные работодателем к работам на высоте, должны быть учтены в локальных документах СУОТ."
PRV_5.,Работодатель для обеспечения безопасности работников должен по возможности исключить работы на высоте.
PRV_6.,"При невозможности исключения работ на высоте работодатель должен обеспечить реализацию мер СУОТ по снижению установленных уровней профессиональных рисков, связанных с возможным падением работника, в том числе путем использования следующих инженерных (технических) методов ограничения риска воздействия на работников идентифицированных опасностей:
а) применение защитных ограждений высотой 1,1 м и более, обеспечивающих безопасность работника от падения на площадках и рабочих местах;
б) применение инвентарных конструкций лесов, подмостей, устройств и средств подмащивания, применением подъемников (вышек), строительных фасадных подъемников, подвесных лесов, люлек, машин или механизмов;
в) использование средств коллективной и индивидуальной защиты."
PRV_7.,"Работы с высоким риском падения работника с высоты, а также работы на высоте без применения средств подмащивания, выполняемые на высоте 5 м и более; работы, выполняемые на площадках на расстоянии менее 2 м от неогражденных (при отсутствии защитных ограждений) перепадов по высоте более 5 м либо при высоте ограждений, составляющей менее 1,1 м, выполняются по заданию работодателя на производство работ с выдачей оформленного на специальном бланке наряда-допуска на производство работ (далее - наряд-допуск) (рекомендуемый образец предусмотрен приложением N 2 к Правилам)."
PRV_8.,"Работы на высоте, для которых принятыми работодателем мерами обеспечения безопасности работника обеспечен допустимый минимальный риск его падения, в том числе, указанные в подпунктах ""а"" и ""б"" пункта 6, а также периодически повторяющиеся работы на высоте, указанные в пункте 7, и которые являются неотъемлемой частью действующего технологического процесса, характеризующиеся постоянством места, условий и характера работ, применением средств коллективной защиты, определенным и постоянным составом квалифицированных исполнителей, в соответствии с действующей у работодателя СУОТ можно проводить без оформления наряда-допуска.
Меры безопасности при проведении указанных работ должны быть изложены в технологических картах, инструкциях по охране труда или производственных инструкциях с учетом требований настоящих Правил."
PRV_9.,"Допускается возможность ведения документооборота в области охраны труда в электронном виде с использованием электронной подписи или любого другого способа, позволяющего идентифицировать личность работника, в соответствии с законодательством Российской Федерации."
PRV_10.,"Работодатель в зависимости от специфики своей деятельности и исходя из оценки уровня профессионального риска вправе:
а) устанавливать дополнительные требования безопасности, не противоречащие Правилам. Требования охраны труда должны содержаться в соответствующих инструкциях по охране труда, доводиться до работника в виде распоряжений, указаний, инструктажа;
б) в целях контроля за безопасным производством работ применять приборы, устройства, оборудование и (или) комплекс (систему) приборов, устройств, оборудования, обеспечивающие дистанционную видео-, аудио или иную фиксацию процессов производства работ."
PRV_11.,"Требования Правил учитываются при проектировании объектов, зданий, сооружений, при разработке технологических процессов и проектов производства работ по сборке, монтажу и демонтажу, а также эксплуатации механизмов или оборудования, зданий и сооружений."
PRV_12.,"К работе на высоте допускаются лица, достигшие возраста восемнадцати лет."
PRV_13.,"Работники, выполняющие работы на высоте, должны иметь квалификацию, соответствующую характеру выполняемых работ. Уровень квалификации подтверждается документом о профессиональном образовании (обучении) и (или) о квалификации."
PRV_14.,"Работники, допускаемые к непосредственному выполнению работ на высоте, выполняемых с оформлением наряда-допуска, делятся на следующие группы по безопасности работ на высоте (далее - группы):
1 группа - работники, допускаемые к работам в составе бригады или под непосредственным контролем работника, назначенного приказом работодателя (далее - работники 1 группы);
2 группа - бригадиры, мастера, руководители стажировки, а также работники, назначаемые по наряду-допуску ответственными исполнителями (производителями) работ на высоте и работники, допускаемые к работам в составе бригады из числа высококвалифицированных рабочих и специалистов (далее - работники 2 группы);"
PRV_15.,"К работникам 3 группы по безопасности работ на высоте (далее указанные категории - работники 3 группы) относятся:
а) работники, назначаемые работодателем ответственными за организацию и безопасное проведение работ на высоте, в том числе выполняемых с оформлением наряда-допуска;
б) ответственные за составление плана мероприятий по эвакуации и спасению работников при возникновении аварийной ситуации и при проведении спасательных работ;
в) работники, проводящие обслуживание и периодический осмотр средств индивидуальной защиты (далее - СИЗ);
г) работники, выдающие наряды-допуски;
д) ответственные руководители работ на высоте, выполняемых с оформлением наряда-допуска;
е) должностные лица, в полномочия которых входит утверждение плана производства работ на высоте и/или технологических карт на производство работ на высоте;
ж) специалисты, проводящие обучение работам на высоте,
з) члены экзаменационных комиссий работодателей и организаций, проводящих обучение безопасным методам и приемам выполнения работ на высоте.
Работники, относящиеся к 3 группе по безопасности работ на высоте, также могут быть допущены к непосредственному выполнению работ, при условии подтверждения квалификации и получения удостоверений на соответствующую группу."
PRV_16.,"Работодатель (уполномоченное им лицо) обязан организовать до начала проведения работы на высоте обучение безопасным методам и приемам выполнения работ на высоте работников:
а) допускаемых к работам на высоте впервые;
б) переводимых с других работ, если указанные работники ранее не проходили соответствующего обучения;
в) имеющих перерыв в работе на высоте более одного года."
PRV_17.,"Работники, выполняющие работы на высоте, должные знать и уметь применять безопасные методы и приемы выполнения работ на высоте, а также обладать соответствующими практическими навыками.
Обучение работников безопасным методам и приемам выполнения работ на высоте (в том числе практическим навыкам применения соответствующих СИЗ, их осмотра до и после использования) в заочной форме, а также исключительно с использованием электронного обучения и дистанционных технологий, проведение практических занятий по освоению безопасных методов и приемов выполнения работ на высоте, а также прохождения стажировки в режиме самоподготовки работником не допускается."
PRV_18.,"Работники, впервые допускаемые к работам на высоте, в том числе, выполняющие работы на высоте с применением средств подмащивания, а также на площадках с защитными ограждениями высотой 1,1 м и более должны:
а) знать инструкции по охране труда при проведении работ на высоте;
б) знать общие сведения о технологическом процессе и оборудовании на данном рабочем месте, производственном участке, в цехе;
в) знать производственные инструкции;
г) знать условия труда на рабочем месте;
д) знать обстоятельства и характерные причины несчастных случаев, аварий, пожаров, происшедших на высоте в организациях (на предприятиях), случаи производственных травм, полученных при работах на высоте; обязанностями и действиями при аварии, пожаре; способы применения имеющихся на участке средств тушения пожара, противоаварийной защиты и сигнализации, места их расположения, схемами и маршрутами эвакуации в аварийной ситуации;
е) знать основные опасные и вредные производственные факторы, характерные для работы на высоте;
ж) знать зоны повышенной опасности, машины, механизмы, приборы, средства, обеспечивающие безопасность работы оборудования (предохранительные, тормозные устройства и ограждения, системы блокировки и сигнализации, знаки безопасности);
з) знать и уметь применять безопасные методы и приемы выполнения работ на высоте.
Работники, впервые допускаемые к работам на высоте, должны обладать практическими навыками применения оборудования, приборов, механизмов (проверка исправности оборудования, пусковых приборов, инструмента и приспособлений, блокировок, заземления и других средств защиты) и оказания первой помощи пострадавшим, практическими навыками применения соответствующих СИЗ, их осмотром до и после использования."
PRV_19.,"Работники 1 группы по безопасности работ на высоте (работники, допускаемые к работам в составе бригады или под непосредственным контролем работника, назначенного приказом работодателя) дополнительно должны:
а) знать методы и средства предупреждения несчастных случаев и профессиональных заболеваний;
б) знать и уметь применять основы техники эвакуации и спасения;
в) обладать практическими навыками оказания первой помощи пострадавшему."
PRV_20.,"Работники 2 группы по безопасности работ на высоте (мастера, бригадиры, руководители стажировки, а также работники, назначаемые по наряду-допуску на производство работ на высоте ответственными исполнителями (производителями) работ на высоте) в дополнение к требованиям, предъявляемым к работникам 1 группы по безопасности работ на высоте, должны быть ознакомлены с:
а) требованиями норм, правил, стандартов и регламентов по охране труда и безопасности работ; порядком расследования и оформления несчастных случаев и профессиональных заболеваний;
б) правилами и требованиями пользования, применения, эксплуатации, выдачи, ухода, хранения, осмотра, испытаний, браковки и сертификации средств защиты;
в) организацией и содержанием рабочих мест; средствами коллективной защиты, ограждениями, знаками безопасности.
Работники 2 группы по безопасности работ на высоте должны иметь опыт работы на высоте более 1 года, уметь осуществлять непосредственное руководство работами, осуществлять надзор за членами бригады, проводить спасательные мероприятия, организовывать безопасную транспортировку пострадавшего, а так же обладать практическими навыками оказания первой помощи пострадавшему."
PRV_21.,"Работники 3 группы по безопасности работ на высоте в дополнение к требованиям по знаниям, предъявляемым к работникам 2 группы по безопасности работ на высоте, должны:
а) обладать полным представлением о рисках падения и уметь проводить осмотр рабочего места;
б) знать соответствующие работам правила, требования по охране труда;
в) знать мероприятия, обеспечивающие безопасность работ;
г) уметь организовывать безопасное проведение работ, разработку плана производства работ; оформлять наряды-допуски, осуществлять надзор за членами бригады;
д) уметь четко обозначать и излагать требования о мерах безопасности при проведении целевого инструктажа работников;
е) уметь обучать персонал безопасным методам и приемам выполнения работ, практическим приемам оказания первой помощи;
ж) обладать знаниями по проведению инспекции СИЗ.
Требования, предъявляемые к преподавателям и работникам 3 группы по безопасности работ на высоте: старше 21 года, опыт выполнения работ на высоте более 2-х лет."
PRV_22.,"Необходимость периодического обучения работников, выполняющих работы на высоте с применением средств подмащивания, а также на площадках и рабочих местах с защитными ограждениями высотой 1,1 м и более, устанавливается работодателем при реализации процедуры подготовки работников по охране труда СУОТ."
PRV_23.,"Периодическое обучение работников 1 и 2 групп безопасным методам и приемам выполнения работ на высоте осуществляется не реже 1 раза в 3 года.
Периодическое обучение работников 3 группы безопасным методам и приемам выполнения работ на высоте осуществляется не реже 1 раза в 5 лет."
PRV_24.,"Обучение безопасным методам и приемам выполнения работ на высоте завершается экзаменом.
Экзамен проводится экзаменационными комиссиями, создаваемыми приказом руководителя организации, проводящей обучение безопасным методам и приемам выполнения работ на высоте. Состав экзаменационных комиссий для приема экзамена у работников, допускаемых к проведению работ на высоте, выполняемых с оформлением наряда-допуска, формируется из работников 3 группы."
