punkt,text
PSR_87.,"Уборка стружки, обрезков, пыли и грязи с оборудования или механизмов должна производиться работниками, работающими на данном оборудовании (механизмах), только при полном отключении оборудования и механизмов с помощью уборочных средств, исключающих травмирование работников.
Уборка и чистка частей оборудования и механизмов, а также арматуры и приборов, находящихся под напряжением, запрещается."
PSR_88.,"В производственных помещениях при периодическом или постоянном стоке жидкостей по поверхности пола (воды, кислот, щелочей, органических растворителей, минеральных масел, эмульсий, нейтральных, щелочных или кислотных растворов и другой жидкости) полы должны быть непроницаемы для этих жидкостей и иметь уклоны для стока жидкостей к лоткам, трапам или каналам.
Трапы и каналы для стока жидкостей на уровне поверхности пола должны быть закрыты крышками или решетками. Сточные лотки должны быть расположены в стороне от проходов и проездов и не должны пересекать их.
Устройства для стока поверхностных вод (лотки, кюветы, каналы, трапы и их решетки) необходимо своевременно очищать и ремонтировать."
PSR_89.,"Для предупреждения воздействия на работников вредных производственных факторов (неблагоприятного микроклимата, шума, вибрации, пыли и вредных веществ в воздухе рабочей зоны) необходимо:
1) определить участки работ, на которых могут возникнуть вредные производственные факторы, обусловленные технологией и условиями выполнения работ;
2) определить средства защиты работников;
3) предусматривать при необходимости специальные меры по хранению опасных и вредных веществ."
PSR_90.,"При проведении строительного производства с применением строительных машин, механизмов или иного технологического оборудования необходимо предусматривать:
1) выбор типов машин, мест их установки и режимов работы в соответствии с параметрами, предусмотренными технологией работ и условиями производства работ;
2) мероприятия, ограничивающие зону действия машин для предупреждения возникновения опасной зоны в местах нахождения людей, а также применение ограждений зоны работы машин;
3) особые условия установки машин в зоне призмы обрушения грунта, на насыпном грунте или косогоре."
PSR_91.,"Ввод в эксплуатацию стационарного технологического оборудования, установленного на строительных площадках (бетонных или растворных заводов, строительных подъемников, компрессорных станций и тому подобное), производится совместным решением работников, ответственных за обеспечение охраны труда при проведении строительных работ на данной площадке и безопасную эксплуатацию данного вида оборудования."
PSR_92.,"Включение (запуск) и эксплуатация транспортных средств, строительных машин, технологического оборудования и других средств механизации должны производиться работником, за которым они закреплены, имеющим право управления этим средством.
Оставлять без надзора транспортные средства, строительные машины, технологическое оборудование и другие средства механизации с работающим (включенным) двигателем запрещается."
PSR_93.,"Перед началом выполнения работ в ограниченных и замкнутых пространствах, в которых возможно появление опасного газа, в том числе в емкостях, колодцах, траншеях и шурфах, необходимо провести анализ воздушной среды.
При появлении опасных газов производство работ в данном месте следует приостановить и продолжить их только после обеспечения рабочих мест вентиляцией (проветриванием) и (или) работников необходимыми средствами индивидуальной защиты."
PSR_94.,"Запрещается использование полимерных материалов и изделий с взрывоопасными и токсичными свойствами, а также строительное сырье и материалы, в том числе полимерные и синтетические материалы, производственные отходы для повторной переработки и использования, лом черных и цветных металлов (металлолом) без ознакомления с инструкциями по их применению."
PSR_95.,"При хранении материалов, содержащих вредные или взрывоопасные растворители, должны быть исключены риски возникновения возгорания и выделения вредных веществ."
PSR_96.,"Перед проведением технического обслуживания и ремонта технологического оборудования и механизмов они должны быть приведены в состояние, при котором исключена возможность самопроизвольного включения и приведения их в действие. На пусковых устройствах, обеспечивающих включение (отключение) электропитания, должны быть вывешены плакаты, указывающие, что оборудование находится в ремонте и пуск его запрещен. Приводные ремни должны быть сняты с рабочих шкивов, под пусковые педали поставлены соответствующие подкладки.
При проведении технического обслуживания и ремонта сборочные единицы оборудования или транспортного средства, имеющие возможность перемещаться под воздействием собственной массы, должны быть заблокированы механическим способом или опущены на опору с исключением возможности их самопроизвольного перемещения.
Ремонт оборудования и механизмов во время их работы запрещается."
PSR_97.,"Снимаемые при ремонте части оборудования должны устойчиво размещаться на специально отведенных местах. Круглые детали следует укладывать с применением упоров.
Съем узлов и деталей станка необходимо производить с применением специальных приспособлений и устройств."
PSR_98.,"Работы на высоте, в том числе с применением средств механизации, оснастки, приспособлений и средств подмащивания (электротали, домкраты, грузовые лебедки, люльки, подмости, передвижные леса, лестницы, стремянки), переносных ручных машин и инструмента (электродрели, электропилы, рубильные и клепальные пневматические молотки, кувалды, ножовки и другие), должны производиться в соответствии с правилами по охране труда при работе на высоте, утверждаемыми Минтрудом России в соответствии с подпунктом 5.2.28 Положения о Министерстве труда и социальной защиты Российской Федерации, утвержденного постановлением Правительства Российской Федерации от 19 июня 2012 г. N 610 (Собрание законодательства Российской Федерации, 2012, N 26, ст. 3528).
Работники, эксплуатирующие средства механизации, оснастку, приспособления, средства подмащивания, переносные ручные машины и инструмент до начала работ должны быть обучены безопасным методам и приемам работ с их применением в соответствии с требованиями охраны труда, инструкций изготовителей и инструкций по охране труда, разработанных работодателем."
PSR_99.,"Лебедки, применяемые для перемещения подъемных подмостей и устанавливаемые на земле, должны быть загружены балластом, вес которого должен не менее чем в два раза превышать тяговое усилие лебедки.
Балласт должен быть закреплен на раме лебедки. Количество витков каната на барабане лебедки при нижнем положении груза должно быть не менее двух."
PSR_100.,"Поверхность грунта, на которую устанавливаются средства подмащивания, должна быть спланирована (выровнена и утрамбована) с обеспечением отвода с нее поверхностных вод. В тех случаях, когда невозможно выполнить эти требования, средства подмащивания оборудуются регулируемыми опорами для обеспечения горизонтальности установки или временными опорными сооружениями, обеспечивающими горизонтальность установки средств подмащивания."
PSR_101.,"Средства подмащивания, расположенные в непосредственной близости от проездов транспортных средств, должны быть ограждены отбойными брусами."
PSR_102.,"Подвесные лестницы и площадки, применяемые для работы на конструкциях, должны устанавливаться и закрепляться на монтируемые конструкции до подъема последних."
PSR_103.,"Места установки приставных лестниц на участках движения транспортных средств или людей надлежит на время производства работ ограждать или охранять.
Строительные леса и другие средства подмащивания с площадками, огражденными перилами, следует применять при проведении работ:
1) около и над вращающимися работающими машинами, транспортерами;
2) с использованием ручных машин и порохового инструмента;
3) газосварочных и электросварочных работ;
4) по натяжению проводов и поддержанию на высоте тяжелых деталей."
PSR_104.,"Работодатель обязан в рамках СУОТ с учетом пункта 5 Правил разработать мероприятия обеспечивающие безопасность работников, связанных с опасностями и их источниками, представляющих угрозу жизни и здоровью работников при разборке (разрушении) зданий и сооружений (далее - строения) в процессе их реконструкции или сноса."
PSR_105.,"Разборку (разрушение) строений необходимо осуществлять на основе решений, предусмотренных в организационно-технологической документации на производство работ. Указанные решения должны быть приняты после проведения обследования общего состояния строения, а также фундаментов, стен, колонн, сводов и прочих конструкций. По результатам обследования составляется акт, на основании которого принимается решение о:
1) выборе метода проведения разборки (разрушения);
2) установлении последовательности выполнения работ, исключающих самопроизвольное обрушение конструкций;
3) установлении опасных зон при принятом методе разборки (разрушении) и применении при необходимости защитных ограждений;
4) временном или постоянном закреплении или усилении конструкций разбираемого строения с целью предотвращения случайного обрушения конструкций;
5) мероприятиях по пылеподавлению в процессе разрушения конструкций и их погрузке;
6) мерах безопасности при работе на высоте;
7) схемах строповки при демонтаже конструкций и оборудования."
PSR_106.,"Перед началом работ необходимо ознакомить работников с решениями, предусмотренными в организационно-технологической документации на строительное производство, и провести инструктаж о безопасных методах работ.
Удаление неустойчивых конструкций при разборке строения следует производить в присутствии руководителя (производителя) работ."
PSR_107.,"Работы по разборке (разрушению) строений выполняются после мероприятий, связанных с отселением проживающих в них граждан (выездом расположенных организаций), отключением от сетей водоснабжения, теплоснабжения, газоснабжения и электроснабжения, канализации, технологических продуктопроводов и принятием мер против их повреждения."
PSR_108.,"При разборке (разрушении) строений доступ к ним посторонних лиц, не участвующих в производстве работ, запрещается. Участки работ по разборке (разрушению) строений должны быть ограждены.
Проход работников в помещения во время разборки должен быть закрыт."
PSR_109.,"При разборке (разрушении) строений механизированным способом необходимо установить опасные для людей зоны, а машины (механизмы) разместить вне зоны обрушения конструкций.
Кабина машиниста должна быть защищена от возможного попадания отколовшихся частиц, а работники должны быть обеспечены защитными очками."
PSR_110.,"Работники, занятые разборкой строений, а также уборкой отходов и мусора, должны быть обеспечены средствами защиты органов дыхания от находящихся в воздухе пыли и микроорганизмов (плесени, грибков, их спор)."
PSR_111.,"Места с возможным появлением газа или вредных веществ перед допуском в них работников необходимо проветрить. При неожиданном появлении газа работы следует прекратить и вывести работников из опасной зоны.
Работники, работающие в местах с возможным появлением газа, должны быть обеспечены защитными средствами (противогазами)."
PSR_112.,"Разборку (разрушение) строений (демонтаж конструкций) необходимо осуществлять последовательно сверху вниз.
Запрещается разборка (разрушение) строений одновременно в нескольких ярусах по одной вертикали."
PSR_113.,"При разборке (разрушении) строений необходимо оставлять проходы на рабочие места.
При разборке кровли и наружных стен работники должны применять системы обеспечения безопасности работ на высоте."
PSR_114.,"При разборке карнизов и свисающих частей строения находиться на стене запрещается.
Не допускается выполнение работ во время гололеда, тумана, дождя, исключающего видимость в пределах фронта работ, грозы, ветра со скоростью 6 м/сек и более, порывов ветра - 10 м/сек и более."
PSR_115.,"При разборке (разрушении) строений необходимо предотвратить самопроизвольное обрушение или падение конструкций.
Неустойчивые конструкции, находящиеся в зоне выполнения работ, следует удалять или закреплять, или усиливать согласно организационно-технологической документации на строительное производство.
Запрещается подрубать дымовые трубы, каменные столбы и простенки вручную, а также производить обрушение их на перекрытие."
PSR_116.,"При разборке (разрушении) строений способом ""валки"" длина прикрепленных тросов (канатов) должна быть в 3 раза больше высоты строения."
PSR_117.,При разборке строений взрывным способом необходимо соблюдать установленные требования безопасности.
PSR_118.,"При демонтаже конструкций и оборудования с помощью подъемных сооружений необходимо соблюдать требования Правил.
Способы освобождения, а также схемы строповки демонтируемых конструкций должны соответствовать способам освобождения и схемам строповки, предусмотренным в организационно-технологической документации на строительное производство."
PSR_119.,"Материалы, получаемые от разборки (разрушения) строений, а также строительный мусор необходимо опускать по закрытым желобам или в закрытых ящиках или контейнерах при помощи подъемных сооружений. Нижний конец желоба должен находиться не выше 1 м над землей или входить в бункер.
Сбрасывать мусор без желобов или других приспособлений разрешается с высоты не более 3 м. Опасные зоны в этих местах необходимо ограждать. Размеры опасной зоны устанавливаются в соответствии с организационно-технологической документацией на производство работ."
PSR_120.,"Работодатель обязан в рамках СУОТ с учетом пункта 5 Правил проанализировать опасности и их источники, представляющие угрозу жизни и здоровью работников при выполнении работ с размещением рабочих мест в выемках и траншеях, связанных со вскрытием грунта на глубину более 30 см (за исключением пахотных работ), забивкой и погружением свай при возведении объектов и сооружений всех видов, подземных и наземных инженерных сетей, коммуникаций, а равно отсыпка грунтом на высоту более 50 см (далее - земляные работы)."
