punkt,text
PSR_1.,"Правила по охране труда при строительстве, реконструкции и ремонте (далее - Правила) устанавливают государственные нормативные требования охраны труда при проведении строительных работ, выполняемых при новом строительстве, расширении, реконструкции, техническом перевооружении, текущем и капитальном ремонте зданий и сооружений (далее - строительное производство).
Требования Правил обязательны для исполнения работодателями, являющимися индивидуальными предпринимателями, а также работодателями - юридическими лицами независимо от их организационно-правовой формы при организации и осуществлении ими строительного производства."
PSR_2.,"Работодатель (лицо, осуществляющее строительство, расширение, реконструкцию, техническое перевооружение, капитальный ремонт объекта капитального строительства, которым может являться застройщик либо привлекаемое застройщиком или техническим заказчиком на основании гражданско-правового договора физическое или юридическое лицо, соответствующее требованиям градостроительного законодательства Российской Федерации, и которое вправе выполнять определенные виды работ по строительству, расширению, реконструкции, техническому перевооружению, капитальному ремонту объекта капитального строительства самостоятельно или с привлечением других лиц, соответствующих требованиям градостроительного законодательства Российской Федерации) должен обеспечить безопасность строительного производства и безопасную эксплуатацию технологического оборудования, используемого в строительном производстве, соответствие строительного производства требованиям законодательства Российской Федерации об охране труда и иных нормативных правовых актов в сфере охраны труда, а также контроль за соблюдением требований Правил."
PSR_3.,"В соответствии с требованиями Правил работодателем в установленном порядке должна быть организована разработка инструкций по охране труда по профессиям и (или) видам выполняемых работ, которые утверждаются локальными нормативными актами работодателя с учетом мнения соответствующего профсоюзного органа либо иного уполномоченного работниками, участвующими в строительном производстве, (далее - работники) представительного органа (при наличии)."
PSR_4.,"В случае применения технологий и методов работ, материалов, технологической оснастки, инструмента, инвентаря, оборудования и транспортных средств, требования охраны труда к которым не регламентированы Правилами, работодателем должны быть разработаны и проведены мероприятия по охране труда в соответствии с требованиями нормативных правовых актов, содержащих государственные нормативные требования охраны труда (далее - требования охраны труда)."
PSR_5.,"Работодатель, исходя из специфики своего строительного производства и характеристик объекта, обязан в рамках процедуры управления профессиональными рисками системы управления охраной труда (далее - СУОТ) провести оценку профессиональных рисков, связанных со следующими опасностями:
1) используемые им движущиеся машины и механизмы, подвижные части технологического оборудования, передвигающиеся заготовки и строительные материалы,
2) опрокидывание машин;
3) неустойчивое состояния сооружения, объекта, опалубки и поддерживающих креплений;
4) высокие ветровые нагрузки;
5) падающие куски породы, предметы и материалы, самопроизвольно обрушающиеся конструкции зданий и сооружений и их элементы, оборудование, горные породы и грунты;
6) наличие острой кромки, углов, торчащих штырей;
7) работы на высоте;
8) опасность, связанная с выбросом пыли и вредных веществ;
9) опасность, связанная с воздействием шума, в том числе опасность, связанная с возможностью не услышать звуковой сигнал об опасности;
10) опасность недостаточной освещенности или повышенной яркости света в рабочей зоне;
11) опасность воздействия пониженных или повышенных температур воздуха;
12) опасность поражения током;
13) иные опасности, представляющие угрозу жизни и здоровью работников, включенных работодателем в перечень идентифицированных опасностей."
PSR_6.,"Работодатель, обязан проконтролировать наличие и достаточность сведений в документации, представляемой им в рамках специальной оценки условий труда (СОУТ) для идентификации потенциально вредных и (или) опасных производственных факторов строительного производства. Перечень вредных и (или) опасных производственных факторов строительного производства может быть расширен работодателем, исходя из специфики своего строительного производства и характеристик объекта."
PSR_7.,"Работодатель в зависимости от специфики своей деятельности и исходя из оценки уровня профессионального риска вправе:
1) устанавливать дополнительные требования безопасности, не противоречащие Правилам. Требования охраны труда должны содержаться в соответствующих инструкциях по охране труда, доводиться до работника в виде распоряжений, указаний, инструктажа;
2) в целях контроля за безопасным производством работ применять приборы, устройства, оборудование и (или) комплекс (систему) приборов, устройств, оборудования, обеспечивающие дистанционную видео-, аудио или иную фиксацию процессов производства работ."
PSR_8.,"Допускается возможность ведения документооборота в области охраны труда в электронном виде с использованием электронной подписи или любого другого способа, позволяющего идентифицировать личность работника, в соответствии с законодательством Российской Федерации."
PSR_9.,"Организация и проведение строительного производства на объектах капитального строительства должны осуществляться в соответствии с организационно-технологической документацией на строительное производство, которая предусматривает перечень мероприятий и решений по определению технических средств и методов работ для конкретных видов выполняемых процессов и работ, обеспечивающих выполнение требований законодательства Российской Федерации по охране труда."
PSR_10.,"Работодатель при организации строительного производства обязан учесть указанные в организационно-технологической документации на строительное производство опасные зоны, в которых возможно воздействие опасных производственных факторов, связанных или не связанных с технологией и характером выполняемых работ."
PSR_11.,"К опасным зонам с постоянным присутствием опасных производственных факторов в строительном производстве, отражаемым в организационно-технологической документации на строительное производство, относятся:
1) места на расстоянии ближе 2 м от неизолированных токоведущих частей электроустановок;
2) места на расстоянии ближе 2 м от неогражденных (отсутствие защитных ограждений) перепадов по высоте 1,8 м и более либо при высоте защитных ограждений менее 1,1 м."
PSR_12.,"К опасным зонам с возможным воздействием опасных производственных факторов относятся:
1) участки территории строящегося здания (сооружения);
2) этажи (ярусы) зданий и сооружений, над которыми происходит монтаж (демонтаж) конструкций или оборудования;
3) зоны перемещения машин, оборудования или их частей, рабочих органов;
4) места, над которыми происходит перемещение грузов кранами."
PSR_13.,"На границах зон с постоянным присутствием опасных производственных факторов должны быть установлены защитные ограждения, а зон с возможным воздействием опасных производственных факторов - сигнальные ограждения и знаки безопасности."
PSR_14.,"Для исключения работ на высоте в организационно-технологической документации на строительное производство предусматриваются преимущественное первоочередное устройство постоянных ограждающих конструкций (стен, панелей, ограждений балконов и проемов)."
PSR_15.,"В организационно-технологической документации на строительное производство должны быть определены:
1) устройства, предназначенные для организации рабочих мест при производстве строительно-монтажных работ на высоте (далее - средства подмащивания), предназначенные для выполнения данного вида работ или отдельной операции;
2) пути и средства подъема работников на рабочие места при строительстве зданий и сооружений выше 5-и этажей с установкой пассажирских подъемников и (или) лифтов;
3) грузозахватные приспособления, позволяющие осуществлять дистанционную расстроповку длинномерных и крупногабаритных строительных конструкций."
PSR_16.,"В целях предупреждения падения с высоты перемещаемых краном строительных конструкций, изделий, материалов, а также потери их устойчивости в процессе монтажа или складирования в организационно-технологической документации на строительное производство должны быть определены:
1) средства контейнеризации или тара для перемещения штучных или сыпучих материалов, а также бетона или раствора с учетом характера и массы перемещаемого груза и удобства подачи его к месту работ;
2) грузозахватные приспособления (грузовые стропы, траверсы и монтажные захваты), соответствующие массе и габаритам перемещаемого груза, условиям строповки и монтажа;
3) способы строповки, обеспечивающие подачу элементов конструкций при складировании и монтаже в соответствии с проектными решениями;
4) приспособления (пирамиды, кассеты), обеспечивающие устойчивое хранение элементов строительных конструкций;
5) порядок и способы складирования строительных конструкций, изделий, материалов и оборудования;
6) способы временного и окончательного закрепления конструкций;
7) способы удаления отходов строительных материалов и мусора;
8) защитные устройства (защитные улавливающие сетки, защитные перекрытия, козырьки или другие) при необходимости."
PSR_17.,"Перед началом строительного производства на территории действующего объекта (в том числе действующих административных, производственных и иных зданий) работодатель и руководитель (полномочный представитель руководителя) хозяйствующего субъекта, эксплуатирующего объект, должны оформить акт-допуск для производства строительно-монтажных работ на территории действующего объекта строительного производства (рекомендуемый образец предусмотрен приложением N 1 к Правилам) и наряд-допуск на производство работ в местах действия вредных и (или) опасных производственных факторов (рекомендуемый образец предусмотрен приложением N 2 к Правилам) (далее соответственно - акт-допуск, наряд-допуск)."
PSR_18.,"При совместном производстве нескольких видов работ, по которым требуется оформление наряда-допуска, допускается оформление единого наряда- допуска с включением в него требований по безопасному выполнению каждого из вида работ."
PSR_19.,"При выполнении строительного производства на территории действующих объектов строительного производства работодатель обязан совместно со всеми привлекаемыми им по договорам юридическими и физическими лицами, соответствующими требованиям градостроительного законодательства Российской Федерации, участвующими в строительном производстве (далее - участники строительного производства):
1) разработать график выполнения совместных работ, обеспечивающих безопасные условия труда, обязательный для участников строительного производства на данной территории;
2) осуществлять допуск участников строительного производства на производственную территорию в соответствии с требованиями Правил;
3) обеспечивать выполнение общих мероприятий охраны труда и координацию действий участников строительного производства по реализации мероприятий, обеспечивающих безопасность производства работ, согласно акту- допуску и графику выполнения совместных работ."
PSR_20.,"При совместной деятельности на земельном участке, на котором ведутся строительные работы или осуществляется освоение территории (далее - строительная площадка) несколькими работодателями на основании заключенных договоров, включая физических лиц, осуществляющих индивидуальную трудовую деятельность, каждый из них обязан обеспечить безопасные условия труда для привлекаемых ими работников в соответствии с оформленными актом-допуском, графиком выполнения совместных работ и требованиями Правил."
PSR_21.,"Работодателями в соответствии со спецификой производимых работ должен быть организован контроль за состоянием условий и охраны труда с периодичностью, установленной работодателями:
1) контроль исправности используемого оборудования, приспособлений, инструмента, наличия и целостности ограждений, защитного заземления и других средств защиты до начала и в процессе работы на своих рабочих местах, осуществляемый работниками (первый уровень);
2) контроль за состоянием условий и охраны труда, проводимый руководителями (производителями) работ совместно с полномочными представителями работников (второй уровень);
3) контроль за состоянием условий и охраны труда в структурных подразделениях и на участках строительного производства, проводимый работодателем (его полномочными представителями, включая специалистов службы охраны труда) совместного с представителями первичной профсоюзной организации или иного представительного органа работников согласно утвержденным планам (третий уровень).
При обнаружении нарушений требований охраны труда работники должны принять меры к их устранению собственными силами, а в случае невозможности - прекратить работы и информировать непосредственного руководителя (производителя работ).
В случае возникновения угрозы безопасности и здоровью работников непосредственные руководители (производители работ) обязаны прекратить работы и принять меры по устранению опасности, а при необходимости обеспечить эвакуацию людей в безопасное место.
При проведении строительного производства на обособленном участке принятие мер по обеспечению безопасности и охраны труда работников и организации противопожарных мероприятий возлагается на лицо, осуществляющее строительные работы."
