punkt,text
PSR_314.,"При наличии профессиональных рисков, вызванных установленными опасностями, безопасность кровельных работ должна быть обеспечена на основе выполнения требований по охране труда, содержащихся в проектной и организационно-технологической документации на строительное производство:
1) организация рабочих мест на высоте, пути прохода работников на рабочие места, особые меры безопасности при работе на крыше с уклоном;
2) меры безопасности при приготовлении и транспортировании горячих мастик и материалов;
3) методы и средства для подъема на кровлю материалов и инструмента, порядок их складирования, последовательность выполнения работ.
Кровельные работы, выполняемые на высоте без защитных ограждений, должны производиться с применением удерживающих, позиционирующих, страховочных систем и (или) систем канатного доступа в соответствии с нарядом-допуском."
PSR_315.,"Производство кровельных работ газопламенным способом следует осуществлять по наряду-допуску, предусматривающему меры безопасности."
PSR_316.,"При выполнении кровельных работ газопламенным способом необходимо выполнять следующие требования безопасности:
1) баллоны должны быть установлены вертикально и закреплены в специальных стойках;
2) тележки стойки с газовыми баллонами разрешается устанавливать на поверхностях крыши, имеющей уклон до 25%. При выполнении работ на крышах с большим уклоном для стоек с баллонами необходимо устраивать специальные площадки;
3) во время работы расстояние от горелок (по горизонтали) до групп баллонов с газом должно быть не менее 10 м, до газопроводов и резинотканевых рукавов - 3 м, до отдельных баллонов - 5 м.
Запрещается держать в непосредственной близости от места производства работ с применением горелок легковоспламеняющиеся и огнеопасные материалы."
PSR_317.,При применении в конструкции крыш горючих и трудногорючих утеплителей наклейка битумных рулонных материалов газопламенным способом должна осуществляться в соответствии с проектной и организационно-технологической документацией на строительное производство.
PSR_318.,"Места производства кровельных работ, выполняемых газопламенным способом, должны быть обеспечены не менее чем двумя эвакуационными выходами (лестницами), а также первичными средствами пожаротушения."
PSR_319.,"При производстве работ на плоских крышах, не имеющих постоянного ограждения, рабочие места необходимо ограждать в соответствии с требованиями охраны труда.
На малоуклонных крышах, не имеющих постоянного ограждения, должны быть предусмотрены стационарные точки крепления применяемых средств обеспечения безопасности работ на высоте."
PSR_320.,"Для прохода работников, выполняющих работы на крыше с уклоном более 20% (12°), а также на крыше с покрытием, не рассчитанным на нагрузки от веса работающих, необходимо применять трапы шириной не менее 0,3 м с поперечными планками для упора ног. Трапы на время работы должны быть закреплены."
PSR_321.,"При выполнении работ на крыше с уклоном более 20% (12°) должны применяться соответствующие системы обеспечения безопасности работ на высоте либо работы должны производиться со строительных лесов.
Места закрепления средств обеспечения безопасности работ на высоте должны быть указаны в организационно-технологической документации."
PSR_322.,Применяемые для подачи материалов при устройстве кровель краны малой грузоподъемности должны устанавливаться и эксплуатироваться в соответствии с эксплуатационными документами изготовителя. Подъем груза следует осуществлять в контейнерах или таре.
PSR_323.,В непосредственной близости от здания в местах подъема груза и выполнения кровельных работ должны быть обозначены границы опасных зон.
PSR_324.,"Не допускается выполнение кровельных работ во время гололеда, тумана, исключающего видимость в пределах фронта работ, грозы, ветра со скоростью 6 м/сек и более, порывов ветра со скоростью 10 м/сек и более."
PSR_325.,"Кровельные работы на скатных крышах должны проводиться с применением строительных лесов (в том числе - подвесных), фасадных или автомобильных подъемников.
Выполнение кровельных работ по установке (подвеске) готовых водосточных желобов, воронок, труб, а также колпаков и зонтов для дымовых и вентиляционных труб и покрытию парапетов, сандриков, а также отделке свесов следует осуществлять с применением строительных лесов, фасадных или автомобильных подъемников.
Запрещается использование для указанных работ приставных лестниц."
PSR_326.,"Работодатель обязан в рамках СУОТ с учетом пункта 5 Правил проанализировать опасности и их источники, представляющие угрозу жизни и здоровью работников при монтаже инженерного оборудования зданий и сооружений (прокладке трубопроводов, монтаже сантехнического, отопительного, вентиляционного и газового оборудования)."
PSR_327.,"При наличии профессиональных рисков, вызванных установленными опасностями, безопасность при монтаже инженерного оборудования зданий и сооружений должна быть обеспечена на основе выполнения требований по охране труда, содержащихся в проектной и организационно-технологической документации на строительное производство:
1) организация рабочих мест с указанием методов и средств для обеспечения вентиляции, пожаротушения, выполнения работ на высоте;
2) методы и средства доставки и монтажа оборудования;
3) меры безопасности при выполнении работ в траншеях и колодцах;
4) особые меры безопасности при травлении и обезжиривании трубопроводов."
PSR_328.,"Заготовка и подгонка труб должны выполняться в заготовительных мастерских. Выполнение этих работ на подмостях, предназначенных для монтажа трубопроводов, запрещается."
PSR_329.,"Работы по устранению конструктивных недостатков и ликвидации недоделок на смонтированном оборудовании, подвергнутом испытанию, следует проводить только после разработки и утверждения мероприятий по безопасности работ."
PSR_330.,"Установка и снятие перемычек (связей) между смонтированным и действующим оборудованием, а также подключение временных установок к действующим системам (электрическим, паровым, техническим и другим) без письменного разрешения лицом, назначенного приказом работодателя, не допускаются."
PSR_331.,"Монтаж трубопроводов и воздуховодов на эстакадах должен производиться с инвентарных подмостей, снабженных лестницами для подъема и спуска работников.
Подъем и спуск по конструкциям эстакад не допускаются."
PSR_332.,"Запрещается нахождение работников под устанавливаемым оборудованием, монтажными узлами оборудования и трубопроводов до их окончательного закрепления."
PSR_333.,"Перемещение труб в закрепленной траншее следует производить с принятием мер против нарушения креплений траншеи.
Не разрешается скатывать трубы в траншею с помощью ломов и ваг, а также использовать распорки крепления траншей в качестве опор для труб."
PSR_334.,"В помещениях, в которых производится обезжиривание, запрещается пользоваться открытым огнем и допускать искрообразование.
Электроустановки в указанных помещениях должны быть во взрывобезопасном исполнении."
PSR_335.,"Работы по обезжириванию трубопроводов должны выполняться в помещениях, оборудованных приточно-вытяжной вентиляцией. При выполнении работ на открытом воздухе работники должны находиться с наветренной стороны."
PSR_336.,"Место, в котором проводится обезжиривание, необходимо оградить и обозначить знаками безопасности."
PSR_337.,"Работники, занятые на работах по обезжириванию трубопроводов, должны быть обеспечены соответствующими противогазами, спецодеждой, рукавицами и резиновыми перчатками."
PSR_338.,"Монтаж оборудования, трубопроводов и воздухопроводов в непосредственной близости от электрических проводов (в пределах расстояния, равного наибольшей длине монтируемого узла или звена трубопровода) производится при снятом напряжении или при защите электропроводов от механического повреждения диэлектрическими коробами.
При невозможности снятия напряжения работы следует производить по наряду-допуску."
PSR_339.,"При продувке труб сжатым воздухом запрещается находиться в камерах и колодцах, в которых установлены задвижки, вентили, краны и другая запорная арматура."
PSR_340.,"При продувке трубопроводов необходимо установить у концов труб щиты для защиты глаз от окалины, песка.
Запрещается находиться против или в непосредственной близости от незащищенных концов продуваемых труб."
PSR_341.,"В процессе выполнения сборочных операций трубопроводов и оборудования совмещение отверстий и проверка их совпадения в монтируемых деталях должны производиться с использованием специального инструмента (конусные оправки, сборочные пробки и другие). Проверять совпадение отверстий в монтируемых деталях пальцами рук не допускается."
PSR_342.,При монтаже оборудования должна быть исключена возможность самопроизвольного или случайного его включения.
PSR_343.,"При монтаже оборудования с использованием домкратов должны быть приняты меры, исключающие возможность перекоса или опрокидывания домкратов."
PSR_344.,Работы под воздействием сжатого воздуха выполняются с соблюдением требований Правил.
PSR_345.,"Работодатель обязан в рамках СУОТ с учетом пункта 5 Правил проанализировать опасности и их источники, представляющие угрозу жизни и здоровью работников при проведении пневматических и гидравлических испытаний смонтированного оборудования и трубопроводов."
PSR_346.,"При наличии профессиональных рисков, вызванных установленными опасностями, безопасность испытания оборудования и трубопроводов должна быть обеспечена на основе выполнения требований по охране труда, содержащихся в проектной организационно-технологической документации на строительное производство:
1) определение программы проведения испытания;
2) меры безопасности при выполнении работ в траншеях, колодцах и на высоте;
3) особые меры безопасности при проведении пневматических испытаний смонтированного оборудования и трубопроводов, а также опробовании оборудования под нагрузкой."
PSR_347.,Испытания смонтированного оборудования и трубопроводов должны проводиться под непосредственным руководством специалистов монтажной организации.
PSR_348.,"Перед испытанием оборудования руководителю работ необходимо:
1) ознакомить работников, участвующих в испытаниях, с порядком проведения работ и с мероприятиями по безопасному их выполнению;
2) предупредить работников смежных участков о времени проведения испытаний;
3) провести визуальную, а при необходимости с помощью приборов проверку крепления оборудования, состояния изоляции и заземления его электрической части, наличия и исправности арматуры, пусковых и тормозных устройств, контрольно-измерительных приборов и заглушек;
4) оградить и обозначить соответствующими знаками зону испытаний;
5) при необходимости установить аварийную сигнализацию;
6) обеспечить возможность аварийного выключения испытуемого оборудования;
7) проверить отсутствие внутри и снаружи испытуемого оборудования посторонних предметов;
8) обозначить предупредительными знаками временные заглушки, люки и фланцевые соединения;
9) определить границы опасной зоны, связанной с проведением испытаний, установить посты с целью предупреждения об опасной зоне из расчета один пост в пределах видимости другого, но не реже чем каждые 200 м друг от друга;
10) определить места и условия безопасного пребывания работников, занятых испытанием;
11) привести в готовность средства пожаротушения, обеспечить подготовку работников, способных к работе по ликвидации пожара;
12) обеспечить освещенность рабочих мест не менее 50 лк;
13) определить работников, ответственных за выполнение мероприятий по обеспечению безопасности, предусмотренных программой испытаний."
PSR_349.,"Устранение недоделок на испытуемом оборудовании, обнаруженных в процессе испытания, следует производить после его отключения, полной остановки, сброса давления."
PSR_350.,"Одновременное гидравлическое испытание нескольких трубопроводов, смонтированных на одних опорных конструкциях или эстакаде, допускается в случае, если опорные конструкции или эстакады рассчитаны на соответствующие нагрузки."
PSR_351.,"При нахождении трубопроводов в непосредственной близости от жилых или эксплуатируемых общественных или промышленных зданий их пневматические испытания можно производить при условии, что оконные и дверные проемы этих зданий, находящиеся в пределах установленной опасной зоны, закрыты защитными ограждениями (щитами, решетками).
Не допускается производить пневматические испытания трубопроводов в действующих цехах, а также на эстакадах, в каналах и лотках, в которых уложены действующие трубопроводы."
PSR_352.,Осмотр оборудования при проведении испытания разрешается производить после снижения испытательного давления до рабочего.
PSR_353.,При продувке оборудования и трубопроводов после испытания перед открытыми люками и штуцерами должны быть установлены защитные ограждения (экраны).
PSR_354.,Испытание оборудования и трубопроводов под нагрузкой следует производить после их испытания вхолостую.
PSR_355.,"Начинать испытание оборудования разрешается только после своевременного предупреждения окружающих лиц и получения разрешения руководителя испытаний.
В процессе проведения испытаний оборудования не допускается:
снимать защитные ограждения;
открывать люки, ограждения, чистить и смазывать оборудование, прикасаться к его движущимся частям;
производить проверку и исправление электрических цепей, электрооборудования и приборов автоматики."
PSR_356.,При пневматическом испытании трубопроводов предохранительные клапаны должны быть отрегулированы на соответствующее давление.
PSR_357.,Обстукивание сварных швов непосредственно во время испытаний трубопроводов и оборудования не допускается.
PSR_358.,"Присоединение и разъединение линий, подводящих воздух от компрессора к испытываемому трубопроводу, разрешается только после прекращения подачи воздуха и снижения давления до атмосферного."
PSR_359.,"На время проведения пневматических испытаний трубопроводов, находящихся в траншеях, должны быть установлены границы опасной зоны.
Нахождение работников в опасной зоне в период нагнетания в трубопровод воздуха и при выдерживании трубопровода под давлением при испытании на прочность не допускается."
